{
  "allowed_variants": [
    "quá trình suy luận"
  ],
  "attestation_evidence_refs": [],
  "attestation_evidence_sha256": "90781725036accdff0bef48dc391f44d8648c1d6ab7c1049d6e11850944228ec",
  "binding_status": "LEGACY_INCOMPLETE",
  "calibration_artifact_sha256": null,
  "candidate_key": {
    "candidate_id": "cand-inference-vi-01",
    "candidate_version": "1",
    "candidate_vi": "suy luận",
    "dataset_manifest_sha256": "1111111111111111111111111111111111111111111111111111111111111111",
    "effective_sense_contract_sha256": "82eedc4661ad441fd7e1925b61738b3ad97af9c2eacb9ce99f2209b45fe1dd0b",
    "scope_id": "machine_learning",
    "sense_id": "model_execution",
    "sense_inventory_version": "sense-v1",
    "source_term": "inference"
  },
  "certificate_id": "cert-inference-001",
  "certificate_version": "1",
  "constraint_evidence_sha256": null,
  "context_evidence_sha256": "b25632808311efdef1fce79843acdcf6f314c4e8aa9ff921395a674d44a12389",
  "decision_package_sha256": "facc19566a870474729763866726e4a9d2dbf841df4e31019a88c7ebad07afdf",
  "effective_sense_contract_sha256": "82eedc4661ad441fd7e1925b61738b3ad97af9c2eacb9ce99f2209b45fe1dd0b",
  "evidence_summary": {
    "C_mean": 0.88,
    "E_features": {
      "E_authority": 0.75,
      "E_concept": 0.83,
      "E_conventionality": 0.6,
      "E_coverage": 0.8,
      "E_domain": 1.0,
      "E_independence": 0.67
    },
    "attestation_evidence_sha256": "90781725036accdff0bef48dc391f44d8648c1d6ab7c1049d6e11850944228ec",
    "context_evidence_sha256": "b25632808311efdef1fce79843acdcf6f314c4e8aa9ff921395a674d44a12389"
  },
  "forbidden_candidates": [
    "suy diễn logic"
  ],
  "frozen_candidate_contract_sha256": null,
  "gate_policy_artifact_sha256": null,
  "gate_result_sha256": null,
  "gate_summary": [],
  "global_validator_input_sha256": null,
  "input_contract_sha256": null,
  "integrity": {
    "self_sha256": "e0756147e77d974b3469acbfd7467d671d73525279d03a74274ed4f9796ba878"
  },
  "issued_at": "2026-07-28T11:30:00+00:00",
  "policy_version": "global-v1",
  "schema_id": "TerminologyCertificateV1",
  "schema_version": "1.1.0",
  "scope_note": "Machine-learning model execution on new inputs.",
  "sense_inventory_version": "sense-v1",
  "status": "AUTO_APPROVED",
  "threshold_version": "MIGRATED_UNKNOWN",
  "validity_context_refs": [
    {
      "evidence_id": "ctx-1",
      "evidence_type": "CONTEXT",
      "sha256": "bbbbbbbbbbbbbbbbbbbbbbbbbbbbbbbbbbbbbbbbbbbbbbbbbbbbbbbbbbbbbbbb",
      "uri": "artifact://context/ctx-1"
    }
  ]
}
